{
  "$schema": "https://bonsaibauer.github.io/shroudforge/schemas/mod-locale.schema.json",
  "mod": {
    "name": "SF Survival",
    "description": "गिरने से होने वाली क्षति, स्वास्थ्य और मन पुनर्जनन, सहनशक्ति, पानी के भीतर सांस लेने, हथियार स्थायित्व और ठंड से सुरक्षा के लिए सेटिंग्स जोड़ता है।"
  },
  "settings": {
    "noFallDamage": {
      "label": "गिरने से कोई क्षति नहीं",
      "description": "समान कैरेक्टर टेम्पलेट का उपयोग करने वाले खिलाड़ियों के लिए गिरने से होने वाली क्षति को बंद कर देता है।"
    },
    "fastHealthRegen": {
      "label": "फास्ट हेल्थ रीजन",
      "description": "स्वास्थ्य पुनर्जनन को 100 गुना तक बढ़ा देता है। प्राकृतिक स्वास्थ्य पुनर्जनन की आवश्यकता है।"
    },
    "fastManaRegen": {
      "label": "फास्ट मैना रीजेन",
      "description": "मन पुनर्जनन को 100 गुना तक बढ़ा देता है। प्राकृतिक मन पुनर्जनन की आवश्यकता है।"
    },
    "infiniteStamina": {
      "label": "अनंत सहनशक्ति",
      "description": "सहनशक्ति को पूर्ण रखता है और अधिकतम परिवर्तन होने पर स्वचालित रूप से समायोजित हो जाता है।"
    },
    "infiniteUnderwaterBreath": {
      "label": "अनंत पानी के नीचे की सांस",
      "description": "पानी के अंदर सांस लेने के रिजर्व को पूरा रखता है।"
    },
    "infiniteWeaponDurability": {
      "label": "अनंत हथियार स्थायित्व",
      "description": "अन्य खिलाड़ियों द्वारा सुसज्जित वस्तुओं सहित संपूर्ण होस्ट की गई दुनिया के लिए स्थायित्व हानि को अक्षम करता है। अक्षम होने पर पिछली विश्व सेटिंग पुनर्स्थापित करता है।"
    },
    "infiniteFrostTimer": {
      "label": "अनंत फ्रॉस्ट टाइमर",
      "description": "शरीर की गर्मी को अधिकतम रखता है।"
    },
    "infiniteMana": {
      "label": "अनंत मन",
      "description": "मैना को पूर्ण रखता है और अधिकतम परिवर्तन होने पर स्वचालित रूप से समायोजित हो जाता है।"
    }
  },
  "groups": [
    {
      "label": "उत्तरजीविता",
      "description": "व्यक्तिगत उत्तरजीविता विकल्पों को चालू या बंद करें। परिवर्तन तुरंत सहेजे जाते हैं."
    }
  ],
  "changelog": [
    "गिरने से होने वाली क्षति, स्वास्थ्य और मन पुनर्जनन, सहनशक्ति, पानी के भीतर सांस लेने, हथियार स्थायित्व, ठंड से सुरक्षा और मन के लिए आठ सेटिंग्स जोड़ता है।"
  ],
  "strings": {}
}
