{
  "$schema": "https://bonsaibauer.github.io/shroudforge/schemas/mod-locale.schema.json",
  "mod": {
    "name": "SF Unlimited Flight",
    "description": "Justerar segelflygplanets uthållighet och flygkontroller."
  },
  "settings": {
    "unlimitedFlying": {
      "label": "Obegränsad flygning",
      "description": "Låter segelflygplanet luta uppåt utan att förbruka uthållighet."
    },
    "turnSpeed": {
      "label": "Svänghastighet",
      "description": "Multiplikator för segelflygplanets svänghastighet."
    },
    "moveSpeed": {
      "label": "Flythastighet",
      "description": "Multiplikator för segelflygplanets acceleration framåt."
    },
    "liftSpeed": {
      "label": "Lyfthastighet",
      "description": "Multiplikator för segelflygplanets längsgående luftmotstånd. Högre värden ökar luftmotståndet."
    },
    "descendSpeed": {
      "label": "Nedstigningshastighet",
      "description": "Multiplikator för segelflygplanets vertikala luftmotstånd. Högre värden ökar luftmotståndet."
    }
  },
  "groups": [
    {
      "label": "Obegränsat flyg",
      "description": "Hastighetsändringar gäller det aktiva segelflygplanet och alla spelare som använder samma typ."
    }
  ],
  "changelog": [
    "Lägger till kontroller för uppåtflygning, uthållighet, svängning, rörelse framåt, lyft och nedstigning. Spelets ursprungliga värden återställs när modden stängs av."
  ],
  "strings": {}
}
