{
  "$schema": "https://bonsaibauer.github.io/shroudforge/schemas/mod-locale.schema.json",
  "mod": {
    "name": "SF Crafting Essentials",
    "description": "レシピのコストと生産時間を調整し、使用時にサポートされているアイテムが消費されないようにします。"
  },
  "settings": {
    "noResourceCost": {
      "label": "レシピリソースコストなし",
      "description": "起動前に、レシピから直接材料、カテゴリ材料、および水の料金を削除します。レシピ要件はゼロと表示されます。ゲームの再起動が必要です。構築、アップグレード、その他の共有在庫コストに変更はありません。"
    },
    "infiniteItemUse": {
      "label": "アイテム消費なし",
      "description": "使用済みの食品、ポーション、包帯、その他のサポートされているアイテムは、消費されずにインベントリに残ります。サポートされている使用アクションにライブで適用されます。レシピの材料、取引、在庫の移動は変更ありません。一部のアイテムアクションはサポートされていません。"
    },
    "productionTimeMode": {
      "label": "レシピ時間モード",
      "description": "モードを変更するには再起動が必要です。オリジナル モードでは、ゲームの実行中に各レシピ時間をスケールします。固定モードでは、起動時に時間指定されたレシピごとに 1 つの期間が適用されます。",
      "options": {
        "original": "ライブ: オリジナルレシピ回",
        "fixed": "再起動が必要: すべてのレシピに対して 1 つの共有時間"
      }
    },
    "productionSeconds": {
      "label": "秒単位の生産時間",
      "description": "固定モードのすべての時間指定レシピで使用される期間を設定します。再起動後に有効になります。"
    },
    "workshopTimeFactorPercent": {
      "label": "生産期間スケール",
      "description": "ロードされたレシピ時間にライブで適用されます。 0% では、最も短い時間のレシピは 1 秒かかり、他のレシピは相対的な時間を維持します。元のレシピ時間を 100% 復元します。世界速度設定は変更されません。変更は実行中の運用にも影響します。"
    }
  },
  "groups": [
    {
      "label": "リソースとインベントリ",
      "description": "レシピの材料と水のコストは起動前に削除されます。アイテム消費なしでは、サポートされているアイテムを使用しても消費されません。"
    },
    {
      "label": "制作",
      "description": "生産の実行に応じてレシピ時間をスケーリングするか、すべての時間指定されたレシピに対して 1 つの固定期間を使用するかを選択します。選択したモードの設定のみが利用可能です。"
    }
  ],
  "changelog": [],
  "strings": {}
}
