{
  "$schema": "https://bonsaibauer.github.io/shroudforge/schemas/mod-locale.schema.json",
  "mod": {
    "name": "World Editor",
    "description": "ワールドの一部をコピー、回転、保存、貼り付けます。"
  },
  "settings": {
    "rotateBlueprint": {
      "label": "ブループリントを 90 度回転"
    },
    "undoVoxels": {
      "label": "最後の貼り付けを元に戻します"
    },
    "markCursorNext": {
      "label": "次の選択コーナーにマークを付ける"
    },
    "resetEditor": {
      "label": "スタックしたサーバー操作をリセット/解放します"
    },
    "pasteAtCursor": {
      "label": "カーソル位置に貼り付け"
    },
    "captureAndSave": {
      "label": "ブループリントをキャプチャして保存する"
    },
    "panelWidth": {
      "label": "ブループリント パネルの幅"
    },
    "panelHeight": {
      "label": "ブループリント パネルの高さ"
    },
    "panelPositionX": {
      "label": "パネル位置 X (−1 = 中央)"
    },
    "panelPositionY": {
      "label": "パネル位置 Y (ゲーム上から)"
    },
    "maximumCopyableProps": {
      "label": "ブループリントあたりの最大プロパティ"
    },
    "sourceX": {
      "label": "ソース セル X (手動フォールバック)"
    },
    "sourceY": {
      "label": "ソース セル Y (手動フォールバック)"
    },
    "sourceZ": {
      "label": "ソース セル Z (手動フォールバック)"
    },
    "sizeX": {
      "label": "サイズ X (手動フォールバック)"
    },
    "sizeY": {
      "label": "サイズ Y (手動フォールバック)"
    },
    "sizeZ": {
      "label": "サイズ Z (手動フォールバック)"
    },
    "blueprintName": {
      "label": "永続的なブループリント名"
    },
    "blueprintNewName": {
      "label": "名前変更または重複のための新しい名前"
    },
    "pasteVoxelMode": {
      "label": "ボクセル モード",
      "options": {
        "replace": "ターゲット ボクセルを置き換えます",
        "add": "占有ソースボクセルを追加"
      }
    },
    "targetPropMode": {
      "label": "ターゲットのプロップ",
      "options": {
        "keep": "既存のプロップを保持します",
        "replace": "交差する支柱を置き換えます"
      }
    },
    "targetX": {
      "label": "ターゲットセル X"
    },
    "targetY": {
      "label": "ターゲットセル Y"
    },
    "targetZ": {
      "label": "ターゲットセル Z"
    },
    "targetWorldX": {
      "label": "小道具のみのターゲット ワールド X"
    },
    "targetWorldY": {
      "label": "小道具のみのターゲット ワールド Y"
    },
    "targetWorldZ": {
      "label": "小道具専用ターゲットワールドZ"
    },
    "rotationQuarterTurns": {
      "label": "初期ペースト回転 (0 ～ 3、設定されたショートカットを使用してゲーム内で回転)"
    },
    "rotationAxis": {
      "label": "ブループリントの上軸 (キャプチャに保存)",
      "options": {
        "x": "X軸",
        "y": "Y軸",
        "z": "Z軸"
      }
    },
    "entityHandle": {
      "label": "不透明エンティティ ハンドル"
    },
    "templateUuidHigh": {
      "label": "テンプレート UUID 高 (16 進数)"
    },
    "templateUuidLow": {
      "label": "テンプレート UUID が低い (16 進数)"
    },
    "trackingId": {
      "label": "トラッキング ID"
    },
    "feedbackId": {
      "label": "マテリアル フィードバック ID (配置のみ)"
    },
    "entityX": {
      "label": "位置 X"
    },
    "entityY": {
      "label": "位置 Y"
    },
    "entityZ": {
      "label": "位置 Z"
    },
    "boundsMinX": {
      "label": "最小境界 X"
    },
    "boundsMinY": {
      "label": "最小境界 Y"
    },
    "boundsMinZ": {
      "label": "境界最小 Z"
    },
    "boundsMaxX": {
      "label": "境界最大 X"
    },
    "boundsMaxY": {
      "label": "境界最大 Y"
    },
    "boundsMaxZ": {
      "label": "境界最大 Z"
    }
  },
  "groups": [
    {
      "label": "ゲーム内パネル",
      "description": "位置は、論理ピクセル単位でのゲーム ウィンドウに対する相対位置です。 X = −1 はパネルを中央に配置します。 Y は上から下に向かって測定されます。変更はゲームの実行中に適用されます。"
    },
    {
      "label": "ワールド エディターの制限"
    },
    {
      "label": "キーボード ショートカット",
      "description": "ここでショートカットを編集するか、「互換性」→「ホットキー」でショートカットを編集します。変更はプレイ中に適用されます。空のバインディングはショートカットを無効にします。",
      "actions": {
        "rotateBlueprint": {
          "label": "ブループリントを 90 度回転"
        },
        "undoVoxels": {
          "label": "最後の貼り付けを元に戻します"
        },
        "markCursorNext": {
          "label": "次の選択コーナーにマークを付ける"
        },
        "resetEditor": {
          "label": "スタックしたサーバー操作をリセット/解放します",
          "confirm": "サーバーの貼り付けまたは取り消しが停止または不完全な場合、リセット/リリースは専用サーバーにそれを放棄してロックを解放するように要求します。部分的な地形や小道具が残る場合があります。貼り付けはサーバーの確認後にのみロックを解除します。"
        },
        "pasteAtCursor": {
          "label": "カーソル位置に貼り付け",
          "confirm": "アクティブなブループリントを現在のカーソル位置に書き込みますか?"
        },
        "captureAndSave": {
          "label": "ブループリントをキャプチャして保存する"
        }
      }
    },
    {
      "label": "ネイティブ エンティティの操作",
      "description": "スポーンと配置にはネイティブ ゲーム操作が使用されます。",
      "actions": {
        "spawnEntity": {
          "label": "キュープロップスポーン",
          "confirm": "これらの UUID と追跡値を使用してネイティブ プロップ スポーンをキューに入れますか?"
        },
        "placeEntity": {
          "label": "座標に配置",
          "confirm": "これらの座標でネイティブ配置をディスパッチしますか?"
        },
        "destroyEntity": {
          "label": "座標で破壊します",
          "confirm": "これらの座標にネイティブ除去を派遣しますか?"
        }
      }
    },
    {
      "label": "ワールド編集者",
      "description": "ネイティブ ワールド API を使用して、ボクセルとプロップまたはプロップのみのブループリントをキャプチャし、プレビュー、貼り付け、および元に戻すことができます。",
      "actions": {
        "markCursorA": {
          "label": "マークセレクションコーナーA"
        },
        "markCursorB": {
          "label": "マークセレクションコーナーB"
        },
        "markCursorTarget": {
          "label": "マーク貼り付け対象"
        },
        "clearCursorSelection": {
          "label": "カーソルマークをクリア"
        },
        "copyVoxels": {
          "label": "ボクセルとプロップをキャプチャする"
        },
        "capturePropsOnly": {
          "label": "A/B 選択からのみ小道具をキャプチャします"
        },
        "listProps": {
          "label": "ソース領域内のプロパティをリストします"
        },
        "resolveRecipes": {
          "label": "ビルド レシピを解決する"
        },
        "saveBlueprint": {
          "label": "世界の青写真を救え"
        },
        "loadBlueprint": {
          "label": "ワールド ブループリントをロードします"
        },
        "refreshBlueprintLibrary": {
          "label": "ブループリント フォルダーを更新します"
        },
        "renameLibraryBlueprint": {
          "label": "ブループリントの名前を新しい名前に変更します"
        },
        "duplicateLibraryBlueprint": {
          "label": "ブループリントを新しい名前で複製します"
        },
        "deleteLibraryBlueprint": {
          "label": "ブループリントとイメージを削除",
          "confirm": "名前付きブループリントとそのイメージをエクスポート フォルダーから削除しますか?"
        },
        "pasteVoxels": {
          "label": "アクティブなブループリントを貼り付けます",
          "confirm": "アクティブなブループリントをターゲット アンカーに書き込みますか?"
        },
        "previewPaste": {
          "label": "配置計画のプレビュー (ログのみ)"
        },
        "undoVoxels": {
          "label": "最後のワールドの貼り付けを元に戻します"
        },
        "destroySelectedProp": {
          "label": "選択したリストされたプロップを破棄します"
        }
      }
    }
  ],
  "changelog": [
    "オンライン F8 キャプチャを追加します。専用サーバーはマークされた地形と小道具を読み取り、Steam P2P 経由で完全な V7 ブループリントを返し、クライアントはそれを検証してローカルに保存します。 648 個のセルと 2 つのプロップを使用してライブで検証し、その後配置して元に戻します。",
    "認証されたクライアントとリクエスト ID ごとに P2P リクエストをキューに入れ、同時アップロードと各クライアントの最新の取り消しジャーナルを分離し、確認後に繰り返し F7 を配置できるようにします。 F4 キーを押すと、最新の配置が元に戻ります。 Incomplete recovery still blocks that client's next paste.",
    "地形、ボクセル セル、および回転したブループリントを含む元のサイズのプロップに対するネイティブの F7 配置と F4 の取り消しを修正します。編集者自身のジャーナルは、ゲームの限られた元に戻す履歴とは関係なく、地形を復元し、配置された小道具を削除します。",
    "ローカル ワールドと専用サーバー Steam P2P リクエストに対して、同じ保護された配置と元に戻すフローを使用します。重複した準備状況チェックと不要なスケール ライター要件を削除し、有効なターゲットを拒否するのではなく、一時的にグリッドが利用できなくなるまで待機します。両方のターゲットで 1,170 個のセルと 1 つのプロップを使用してライブで検証されました。",
    "エディターの更新を 100 ミリ秒ごとに実行し、追加の準備状況チェックを最大 2 秒に 1 回に制限し、アクティブな操作中にそれらのチェックを一時停止します。",
    "リモート サーバー検出フォールバックとクライアント認証をローダー所有のネットワーク モジュールに移動します。エディターは自動ヘルスプローブ検出を使用するようになりました。",
    "再起動のたびにローカル専用サーバーの現在の SteamID を検出し、60 秒後に応答のない P2P リクエストを、結果が不明であるという明示的な警告とともに報告します。",
    "サーバーが発行した元に戻すトークンをクライアントの再起動後も保持し、サーバーの未解決のジャーナルを失う代わりに自動的に再開します。",
    "検証されたライブワールドコンテキストからローカルネイティブ書き込みまたは専用サーバー Steam P2P を自動的に選択します。コンテキストが不明な間は編集を一時停止します。",
    "ワールド ターゲットを明示的にします。ローカル/シングルプレイヤーは直接クライアント パス上に留まります。専用サーバー編集では Steam P2P を使用します。",
    "マルチプレイヤー ブループリントの配置と取り消しを Steam P2P 経由で専用サーバーのネイティブ ワールド ランタイムにルーティングします。シングルプレイヤーでの直接の編集を保持します。",
    "明示的な SteamID64 許可リストとサーバー所有の UNDO ジャーナルを使用して、同じワールド エディター モジュールを専用サーバー上でヘッドレスで実行します。",
    "実験的なクライアント ゲーム入力ブループリントの貼り付けパスを削除します。既存の SFBP V7 形式とネイティブ ダイレクト プランナーを保持します。",
    "回転およびスケールされた ItemInfo 配置境界フィルターを、登録されたネイティブ ワールド クエリに移動します。",
    "プロップ キャプチャ、ブループリント ファイル、および貼り付けを通じて、ネイティブ エンティティ テンプレート UUID を保持します。",
    "キャプチャされたプロップ スケールを専用の検証済みネイティブ変換更新で保存します。",
    "V6 プロップのみのブループリントと、グリッド配置チェックを備えた ShroudEdit スタイルのワールド空間配置アンカーを追加します。",
    "エンティティ ハンドル、変換読み取り、ハンドルを対象とした安全な削除、およびボクセル グリッド メタデータに、登録されたネイティブ ワールド API を使用します。",
    "スタンドアロン MOD をワールドエディターとしてパッケージ化し、キーボード ショートカットで F3 回転を公開します。",
    "ブループリント管理に、コンテキスト指示ライン、ブループリント ライブラリ、およびスクリーンショット フォルダー ブラウザーを備えた、F2 で制御される単一のブループリント ウィンドウを追加します。",
    "F3 ～ F8 ショートカット、カーソル ターゲットの貼り付け、キャプチャからブループリントへのワークフロー、回転および貼り付けモード、競合チェック付きの取り消しを追加します。 F1 は引き続きゲームで利用できます。"
  ],
  "strings": {}
}
